{"schema":"nrm.customer.network_plan.v1","messageId":"plan-001","timestamp":"2026-08-13T10:00:00+08:00","source":"CUSTOMER","data":{"planId":"four-network-demo","revision":1,"allocations":[{"allocationId":"allocation-link11","networkName":"nrm_link11","networkType":"LINK11","profileId":"demo-link11-v1","frequencyHz":225000000,"channelId":"L11-DEMO","subnetId":"L11-A","members":["l11_control","l11_member"],"slots":["poll-01"],"routePolicyId":"controlled-star","enabled":true},{"allocationId":"allocation-link16","networkName":"nrm_link16","networkType":"LINK16","profileId":"demo-link16-v1","frequencyHz":1000000000,"channelId":"L16-DEMO","subnetId":"L16-A","members":["l16_fighter","l16_command"],"slots":["slot-001"],"routePolicyId":"shortest-stable","enabled":true},{"allocationId":"allocation-satcom","networkName":"nrm_satcom","networkType":"SATCOM","profileId":"demo-satcom-v1","frequencyHz":20000000000,"channelId":"SAT-DEMO","subnetId":"SAT-A","members":["sat_terminal","sat_gateway"],"slots":["beam-01"],"routePolicyId":"satellite-relay","enabled":true},{"allocationId":"allocation-cdl","networkName":"nrm_cdl","networkType":"CDL","profileId":"demo-cdl-v1","frequencyHz":15000000000,"channelId":"CDL-DEMO","subnetId":"CDL-A","members":["cdl_sensor","cdl_station"],"slots":["channel-01"],"routePolicyId":"direct-high-rate","enabled":true}],"demands":[{"demandId":"demand-l16","businessType":"C2","sourcePlatformId":"l16_fighter","destinationPlatformId":"l16_command","payloadBits":8192,"requiredBandwidthBps":64000,"maximumDelayMs":300,"minimumPdrPercent":90,"allowedNetworks":["LINK16"]}]}}
